Phase,Task ID,Task Name,Description,Priority,Status,Start Week,Duration (Weeks),End Week,% Complete,Owner,Dependencies,Deliverables,Notes
COMPLETED,COMP-001,Multi-Tenant Database Architecture,Database-per-tenant isolation with platform and tenant databases,Critical,Complete,1,8,8,100%,Backend Team,,PostgreSQL setup with multi-tenant schemas,Production ready
COMPLETED,COMP-002,JWT Authentication System,JWT auth with refresh tokens and multi-tenant context,Critical,Complete,2,4,5,100%,Backend Team,COMP-001,Auth endpoints and middleware,Production ready
COMPLETED,COMP-003,Core API Endpoints,Auth/users/wallets/transfers/transactions APIs,Critical,Complete,3,6,8,100%,Backend Team,COMP-002,RESTful API endpoints,Production ready
COMPLETED,COMP-004,Modern Dashboard UI,AI-integrated dashboard with glassmorphic design,High,Complete,5,3,7,100%,Frontend Team,COMP-002,Dashboard screen component,Production ready
COMPLETED,COMP-005,Transfer System UI,Money transfer flow (internal/external/bill payment),High,Complete,6,4,9,100%,Frontend Team,COMP-003,Transfer screens and flows,Production ready
COMPLETED,COMP-006,AI Chat Interface,Conversational AI with voice support and smart suggestions,High,Complete,7,4,10,100%,AI Team,COMP-002,AI assistant integration,Production ready
COMPLETED,COMP-007,Design System,Comprehensive UI design system (1700+ CSS classes),Critical,Complete,4,6,9,100%,Design Team,,Design system documentation and components,Production ready
COMPLETED,COMP-008,Testing Framework,4-layer testing architecture (Unit/Integration/UX/E2E),Critical,Complete,8,3,10,100%,QA Team,,Testing infrastructure and 297 tests,Production ready
COMPLETED,COMP-009,Cloud Deployment,GCP deployment with SSL and fast deployment system,Critical,Complete,9,2,10,100%,DevOps Team,COMP-001,Production environment on 34.59.143.25,Production ready
COMPLETED,COMP-010,Multi-Language Support,4 languages (en/fr/de/es) with i18n,Medium,Complete,9,2,10,100%,Frontend Team,,Translation files and i18n config,Production ready
COMPLETED,COMP-011,Multi-Currency Support,6 currencies with locale-specific formatting,Medium,Complete,9,2,10,100%,Backend Team,,Currency formatting utilities,Production ready
COMPLETED,COMP-012,Transaction History UI,Transaction list and detail screens,High,Complete,6,2,7,100%,Frontend Team,COMP-003,Transaction history screens,Production ready
COMPLETED,COMP-013,Authentication UI,Login and registration screens,Critical,Complete,5,2,6,100%,Frontend Team,COMP-002,Auth screens,Production ready
COMPLETED,COMP-014,Security Screens,Biometric and PIN security screens,Medium,Complete,7,2,8,100%,Frontend Team,COMP-002,Security setup screens,Production ready

PHASE 1,P1-001,JWT Role Claims Enhancement,Add platform_admin and permission claims to JWT,Critical,Not Started,11,1,11,0%,Backend Team,COMP-002,Enhanced JWT structure,Required for platform admin access
PHASE 1,P1-002,Subdomain Detection Middleware,Implement subdomain routing (admin vs tenant),Critical,Not Started,11,1,11,0%,Backend Team,P1-001,Subdomain middleware,Core platform admin feature
PHASE 1,P1-003,Role-Based Authorization Middleware,Create middleware for role and permission checks,Critical,Not Started,11,1,11,0%,Backend Team,P1-001,Auth middleware enhancements,Security critical
PHASE 1,P1-004,Database Query Context Injection,Automatic tenant scoping in database queries,Critical,Not Started,11,2,12,0%,Backend Team,P1-002,Database service layer,Prevents cross-tenant data leaks
PHASE 1,P1-005,Enhanced Auth Context (Frontend),Update AuthContext with role-based state,Critical,Not Started,12,1,12,0%,Frontend Team,P1-001,Enhanced AuthContext component,Frontend foundation
PHASE 1,P1-006,Dynamic UI Rendering System,Component system that adapts to user role,Critical,Not Started,12,2,13,0%,Frontend Team,P1-005,HOC and utility components,Core UI architecture
PHASE 1,P1-007,Platform Admin Dashboard Screen,Cross-tenant metrics and overview dashboard,Critical,Not Started,13,2,14,0%,Frontend Team,P1-006,Platform dashboard component,First admin screen
PHASE 1,P1-008,Tenant Management Screen,List/view/edit all tenants interface,Critical,Not Started,13,2,14,0%,Frontend Team,P1-006,Tenant management UI,Core admin functionality
PHASE 1,P1-009,Tenant Onboarding Workflow Screen,New bank approval and provisioning workflow,High,Not Started,14,2,15,0%,Frontend Team,P1-008,Onboarding workflow screens,Business critical
PHASE 1,P1-010,Platform Analytics Screen,Revenue tracking and business intelligence,High,Not Started,14,2,15,0%,Frontend Team,P1-007,Analytics dashboard,Revenue visibility
PHASE 1,P1-011,System Health Monitoring Screen,Platform monitoring and maintenance interface,High,Not Started,15,1,15,0%,Frontend Team,P1-007,System health dashboard,Operations critical
PHASE 1,P1-012,Billing Management Screen,Subscription and usage-based billing,High,Not Started,15,2,16,0%,Frontend Team,P1-010,Billing management UI,Revenue management
PHASE 1,P1-013,Enhanced Security for Platform Admin,MFA and IP restriction for admin access,Critical,Not Started,13,2,14,0%,Security Team,P1-003,MFA implementation,Security requirement
PHASE 1,P1-014,Platform Admin API Endpoints,Backend APIs for platform admin features,Critical,Not Started,12,3,14,0%,Backend Team,P1-004,Platform admin APIs,Required for admin UI
PHASE 1,P1-015,Integration Testing - Platform Admin,Test platform admin features across all layers,Critical,Not Started,16,1,16,0%,QA Team,P1-012,Test suite for platform admin,Quality gate

PHASE 2A,P2A-001,Transaction Reversal Data Model,Database schema for reversal tracking,Critical,Not Started,17,1,17,0%,Backend Team,COMP-001,Reversal tables and migrations,CBN compliance requirement
PHASE 2A,P2A-002,Reversal Workflow Engine,State machine for reversal lifecycle,Critical,Not Started,17,2,18,0%,Backend Team,P2A-001,Reversal processing engine,Core reversal logic
PHASE 2A,P2A-003,CBN Reversal Compliance Module,Ensure CBN regulatory compliance,Critical,Not Started,18,2,19,0%,Compliance Team,P2A-002,Compliance validation module,Regulatory requirement
PHASE 2A,P2A-004,AI Reversal Pattern Analysis,ML-based fraud detection for reversals,High,Not Started,18,2,19,0%,AI Team,P2A-002,AI pattern detection,Fraud prevention
PHASE 2A,P2A-005,Reversal Management Screen (Admin),Platform admin reversal oversight interface,High,Not Started,19,2,20,0%,Frontend Team,P2A-002,Admin reversal dashboard,Operations tool
PHASE 2A,P2A-006,Reversal Management Screen (Tenant),Bank-specific reversal management,High,Not Started,19,2,20,0%,Frontend Team,P2A-002,Tenant reversal screens,Customer service tool
PHASE 2A,P2A-007,Reversal API Endpoints,REST APIs for reversal operations,Critical,Not Started,17,2,18,0%,Backend Team,P2A-001,Reversal APIs,Required for UI
PHASE 2A,P2A-008,Reversal Testing Suite,Comprehensive tests for reversal system,Critical,Not Started,20,1,20,0%,QA Team,P2A-006,Reversal test suite,Quality assurance

PHASE 2B,P2B-001,NIBSS Production Credentials,Obtain live NIBSS API credentials,Critical,Not Started,17,2,18,0%,Business Team,,NIBSS production access,External dependency
PHASE 2B,P2B-002,NIBSS Name Enquiry (Production),Implement live name enquiry integration,Critical,Not Started,19,2,20,0%,Backend Team,P2B-001,Name enquiry service,Core banking feature
PHASE 2B,P2B-003,NIBSS Fund Transfer (Production),Implement live fund transfer integration,Critical,Not Started,19,3,21,0%,Backend Team,P2B-002,Fund transfer service,Revenue critical
PHASE 2B,P2B-004,NIBSS Transaction Status Query,Implement transaction status checking,High,Not Started,20,2,21,0%,Backend Team,P2B-002,Status query service,Operations requirement
PHASE 2B,P2B-005,NIBSS Error Handling & Retry,Robust error handling and retry logic,Critical,Not Started,21,2,22,0%,Backend Team,P2B-003,Error handling framework,Production stability
PHASE 2B,P2B-006,NIBSS Integration Testing,End-to-end testing with NIBSS sandbox,Critical,Not Started,21,1,21,0%,QA Team,P2B-003,NIBSS test suite,Quality gate
PHASE 2B,P2B-007,External Transfer Screen Enhancement,UI for NIBSS interbank transfers,High,Not Started,22,2,23,0%,Frontend Team,P2B-003,Enhanced transfer screens,User experience

PHASE 2C,P2C-001,Savings Account Data Model,Database schema for savings products,Critical,Not Started,17,1,17,0%,Backend Team,COMP-001,Savings tables and migrations,Foundation for savings
PHASE 2C,P2C-002,Interest Calculation Engine,Automated interest calculation and posting,Critical,Not Started,18,2,19,0%,Backend Team,P2C-001,Interest engine,Revenue generation
PHASE 2C,P2C-003,Savings Product Configuration,Tenant-specific savings product setup,High,Not Started,18,2,19,0%,Backend Team,P2C-001,Product config system,Multi-tenant flexibility
PHASE 2C,P2C-004,Regular Savings Screen,Basic savings account interface,High,Not Started,19,2,20,0%,Frontend Team,P2C-002,Regular savings UI,Entry-level product
PHASE 2C,P2C-005,High-Yield Savings Screen,Premium savings with tier rates,High,Not Started,20,2,21,0%,Frontend Team,P2C-002,High-yield savings UI,Premium product
PHASE 2C,P2C-006,Goal-Based Savings Screen,Target savings with progress tracking,High,Not Started,20,2,21,0%,Frontend Team,P2C-002,Goal savings UI,Customer engagement
PHASE 2C,P2C-007,Locked Savings Screen,Time-locked savings with penalties,High,Not Started,21,2,22,0%,Frontend Team,P2C-002,Locked savings UI,High-yield product
PHASE 2C,P2C-008,Savings API Endpoints,REST APIs for savings operations,Critical,Not Started,18,2,19,0%,Backend Team,P2C-001,Savings APIs,Required for UI
PHASE 2C,P2C-009,Savings Testing Suite,Comprehensive savings product tests,Critical,Not Started,22,1,22,0%,QA Team,P2C-007,Savings test suite,Quality assurance
PHASE 2C,P2C-010,Savings Analytics Dashboard,Platform and tenant savings analytics,Medium,Not Started,22,2,23,0%,Frontend Team,P2C-002,Analytics screens,Business intelligence

PHASE 2D,P2D-001,Loan Account Data Model,Database schema for loan products,Critical,Not Started,21,1,21,0%,Backend Team,COMP-001,Loan tables and migrations,Foundation for loans
PHASE 2D,P2D-002,Credit Bureau Integration,CRC Credit Bureau API integration,Critical,Not Started,22,3,24,0%,Backend Team,P2D-001,Credit bureau service,Risk management
PHASE 2D,P2D-003,AI Credit Scoring Engine,ML-based credit scoring system,High,Not Started,22,3,24,0%,AI Team,P2D-002,AI scoring model,Competitive advantage
PHASE 2D,P2D-004,Loan Approval Workflow,Automated loan approval state machine,Critical,Not Started,23,2,24,0%,Backend Team,P2D-003,Approval workflow engine,Core loan logic
PHASE 2D,P2D-005,Loan Repayment Engine,Automated repayment processing,Critical,Not Started,24,2,25,0%,Backend Team,P2D-001,Repayment processing,Revenue collection
PHASE 2D,P2D-006,Personal Loan Screen,Individual loan application interface,High,Not Started,24,2,25,0%,Frontend Team,P2D-004,Personal loan UI,Mass market product
PHASE 2D,P2D-007,Business Loan Screen,SME loan with enhanced KYC,High,Not Started,25,2,26,0%,Frontend Team,P2D-004,Business loan UI,High-value product
PHASE 2D,P2D-008,Quick Loan Screen,Instant micro-loan interface,High,Not Started,25,2,26,0%,Frontend Team,P2D-003,Quick loan UI,Customer convenience
PHASE 2D,P2D-009,Loan API Endpoints,REST APIs for loan operations,Critical,Not Started,22,2,23,0%,Backend Team,P2D-001,Loan APIs,Required for UI
PHASE 2D,P2D-010,Loan Testing Suite,Comprehensive loan product tests,Critical,Not Started,26,1,26,0%,QA Team,P2D-008,Loan test suite,Quality assurance
PHASE 2D,P2D-011,Loan Analytics Dashboard,Platform and tenant loan analytics,Medium,Not Started,26,2,27,0%,Frontend Team,P2D-004,Loan analytics UI,Risk monitoring

PHASE 3A,P3A-001,Bulk Transfer Data Model,Schema for batch transfer processing,High,Not Started,23,1,23,0%,Backend Team,COMP-003,Bulk transfer tables,Efficiency feature
PHASE 3A,P3A-002,Transfer Templates System,Save and reuse recipient details,High,Not Started,23,2,24,0%,Backend Team,COMP-003,Template management,User convenience
PHASE 3A,P3A-003,Scheduled Transfer Engine,Recurring and future-dated transfers,High,Not Started,24,2,25,0%,Backend Team,COMP-003,Scheduling engine,Advanced feature
PHASE 3A,P3A-004,Bulk Transfer Screen,Multiple transfer processing UI,High,Not Started,25,2,26,0%,Frontend Team,P3A-001,Bulk transfer interface,Business feature
PHASE 3A,P3A-005,Transfer Templates Screen,Beneficiary management interface,High,Not Started,25,2,26,0%,Frontend Team,P3A-002,Template management UI,User experience
PHASE 3A,P3A-006,Enhanced Transfer Testing,Tests for advanced transfer features,High,Not Started,26,1,26,0%,QA Team,P3A-005,Transfer test suite,Quality assurance

PHASE 3B,P3B-001,Multi-Account Data Model,Support multiple accounts per user,Medium,Not Started,24,1,24,0%,Backend Team,COMP-001,Account relationship tables,Advanced banking
PHASE 3B,P3B-002,Joint Account Management,Shared account functionality,Medium,Not Started,25,2,26,0%,Backend Team,P3B-001,Joint account logic,Family banking
PHASE 3B,P3B-003,Account Switching UI,Interface to switch between accounts,Medium,Not Started,26,2,27,0%,Frontend Team,P3B-001,Account switcher component,User experience
PHASE 3B,P3B-004,Multi-Account Management Screen,Overview of all user accounts,Medium,Not Started,26,2,27,0%,Frontend Team,P3B-001,Account overview UI,Convenience feature
PHASE 3B,P3B-005,KYC Enhancement,Enhanced KYC workflow for compliance,High,Not Started,24,3,26,0%,Backend Team,COMP-002,Enhanced KYC system,Regulatory requirement

PHASE 3C,P3C-001,Biller Integration,Nigerian biller network integration,High,Not Started,27,3,29,0%,Backend Team,COMP-003,Biller API integrations,Revenue opportunity
PHASE 3C,P3C-002,Bill Payment Categories,Organize billers by category,Medium,Not Started,27,1,27,0%,Backend Team,P3C-001,Category management,User experience
PHASE 3C,P3C-003,Recurring Bill Payments,Automated recurring payments,High,Not Started,28,2,29,0%,Backend Team,P3C-001,Recurring payment engine,Customer retention
PHASE 3C,P3C-004,Bill Payments Screen,Comprehensive biller interface,High,Not Started,28,2,29,0%,Frontend Team,P3C-001,Bill payment UI,Customer convenience
PHASE 3C,P3C-005,Bill Payment History,Transaction history for bill payments,Medium,Not Started,29,1,29,0%,Frontend Team,P3C-004,History screen,User tracking

PHASE 3D,P3D-001,Save-as-You-Transact Engine,Automated savings on transactions,Medium,Not Started,27,2,28,0%,Backend Team,P2C-001,Auto-save logic,Innovation feature
PHASE 3D,P3D-002,Save-as-You-Transact Screen,Configuration and tracking UI,Medium,Not Started,28,2,29,0%,Frontend Team,P3D-001,Auto-save UI,Customer engagement
PHASE 3D,P3D-003,Advanced Reporting Engine,Customizable reports for tenants,Medium,Not Started,28,3,30,0%,Backend Team,COMP-003,Reporting engine,Business intelligence
PHASE 3D,P3D-004,Report Builder Screen,Custom report generation UI,Medium,Not Started,29,2,30,0%,Frontend Team,P3D-003,Report builder interface,Admin tool
PHASE 3D,P3D-005,Customer Support Integration,Ticketing and support system,Low,Not Started,30,2,31,0%,Backend Team,COMP-002,Support system,Customer service

SECURITY,SEC-001,Production 2FA/MFA,Two-factor authentication for all users,Critical,Not Started,20,3,22,0%,Security Team,COMP-002,MFA system,Security requirement
SECURITY,SEC-002,Enhanced Biometric Auth,Improved biometric authentication,High,Not Started,22,2,23,0%,Security Team,COMP-014,Biometric enhancements,User convenience
SECURITY,SEC-003,HSM Key Management,Hardware security module integration,Critical,Not Started,23,4,26,0%,Security Team,COMP-001,HSM integration,Production security
SECURITY,SEC-004,WAF Protection,Web Application Firewall deployment,Critical,Not Started,24,3,26,0%,DevOps Team,COMP-009,WAF configuration,Attack prevention
SECURITY,SEC-005,Enhanced Fraud Detection,Production AI fraud detection,High,Not Started,25,4,28,0%,AI Team,COMP-006,Fraud detection system,Risk management
SECURITY,SEC-006,Penetration Testing,Security audit and pen testing,Critical,Not Started,28,2,29,0%,Security Team,SEC-004,Security audit report,Compliance requirement
SECURITY,SEC-007,Security Monitoring Dashboard,Real-time security monitoring,High,Not Started,26,2,27,0%,Security Team,SEC-003,Monitoring dashboard,Operations tool

INTEGRATION,INT-001,Paystack Integration,Payment gateway integration,Medium,Not Started,29,3,31,0%,Backend Team,COMP-003,Paystack service,Payment option
INTEGRATION,INT-002,Investment Platform APIs,Third-party investment integrations,Low,Not Started,30,4,33,0%,Backend Team,COMP-003,Investment APIs,Product diversification
INTEGRATION,INT-003,Insurance Product APIs,Insurance product integrations,Low,Not Started,31,4,34,0%,Backend Team,COMP-003,Insurance APIs,Product diversification

OPTIMIZATION,OPT-001,Performance Optimization,Database and API performance tuning,High,Not Started,26,3,28,0%,Backend Team,P2D-005,Performance improvements,User experience
OPTIMIZATION,OPT-002,Mobile Optimization,Native mobile app enhancements,Medium,Not Started,28,2,29,0%,Frontend Team,COMP-005,Mobile optimizations,User experience
OPTIMIZATION,OPT-003,Caching Strategy,Redis caching implementation,High,Not Started,27,2,28,0%,Backend Team,OPT-001,Caching layer,Performance boost
OPTIMIZATION,OPT-004,Load Testing,Performance testing at scale,High,Not Started,29,2,30,0%,QA Team,OPT-001,Load test results,Production readiness
OPTIMIZATION,OPT-005,CDN Implementation,Content delivery network setup,Medium,Not Started,30,1,30,0%,DevOps Team,COMP-009,CDN configuration,Global performance

DOCUMENTATION,DOC-001,API Documentation,Comprehensive API documentation,Medium,Not Started,28,2,29,0%,Backend Team,P2D-009,API docs,Developer experience
DOCUMENTATION,DOC-002,User Guides,End-user documentation,Low,Not Started,30,3,32,0%,Product Team,P2D-008,User guides,Customer support
DOCUMENTATION,DOC-003,Admin Guides,Platform admin documentation,Medium,Not Started,29,2,30,0%,Product Team,P1-012,Admin guides,Operations support
DOCUMENTATION,DOC-004,Tenant Onboarding Docs,New tenant setup documentation,Medium,Not Started,30,2,31,0%,Product Team,P1-009,Onboarding docs,Business enablement